{
  "$schema": "https://json-schema.org/draft/2020-12/schema",
  "$id": "https://lean-lang.org/schemas/lean-eval/public-state-projection-v4.schema.json",
  "title": "lean-eval public State projection schema version 4",
  "type": "object",
  "additionalProperties": false,
  "required": [
    "schema_version", "environment", "source_state_commit", "source_event_count",
    "source_digest", "results", "result_overlays", "model_identities",
    "model_aliases", "model_identity_history"
  ],
  "properties": {
    "schema_version": { "const": 4 },
    "environment": { "$ref": "public-state-projection-v3.schema.json#/properties/environment" },
    "source_state_commit": { "$ref": "public-state-projection-v3.schema.json#/properties/source_state_commit" },
    "source_event_count": { "$ref": "public-state-projection-v3.schema.json#/properties/source_event_count" },
    "source_digest": { "$ref": "public-state-projection-v3.schema.json#/properties/source_digest" },
    "results": { "type": "array", "items": { "$ref": "#/$defs/result" } },
    "result_overlays": { "type": "array", "items": { "$ref": "#/$defs/overlay" } },
    "model_identities": { "type": "array", "items": { "$ref": "#/$defs/identity" } },
    "model_aliases": { "type": "array", "items": { "$ref": "#/$defs/alias" } },
    "model_identity_history": { "type": "array", "items": { "$ref": "#/$defs/history" } }
  },
  "$defs": {
    "modelId": { "type": "string", "pattern": "^mi1_[0-9a-f]{64}$" },
    "aliasKey": { "type": "string", "pattern": "^ma1_[0-9a-f]{64}$" },
    "login": { "type": "string", "pattern": "^[a-z0-9](?:[a-z0-9-]{0,37}[a-z0-9])?$" },
    "label": {
      "type": "string", "minLength": 1, "maxLength": 256,
      "pattern": "^[^\\u0000-\\u001f\\u007f]+$", "x-utf8-maxBytes": 256
    },
    "reason": {
      "type": "string", "pattern": "^[a-z][a-z0-9_]{1,63}$"
    },
    "timestamp": {
      "type": "string", "format": "date-time",
      "pattern": "^(?!0000-)[0-9]{4}-[0-9]{2}-[0-9]{2}T[0-9]{2}:[0-9]{2}:[0-9]{2}\\.[0-9]{3}Z$"
    },
    "nullableModelId": { "oneOf": [{ "$ref": "#/$defs/modelId" }, { "type": "null" }] },
    "nullableEventId": {
      "oneOf": [
        { "$ref": "public-state-projection-v1.schema.json#/$defs/eventId" },
        { "type": "null" }
      ]
    },
    "nullableTimestamp": {
      "oneOf": [
        { "$ref": "#/$defs/timestamp" },
        { "type": "null" }
      ]
    },
    "nullableLabel": {
      "oneOf": [{ "$ref": "#/$defs/label" }, { "type": "null" }]
    },
    "nullableReason": {
      "oneOf": [{ "$ref": "#/$defs/reason" }, { "type": "null" }]
    },
    "result": {
      "type": "object", "additionalProperties": false,
      "required": [
        "result_id", "problem_id", "statement_revision", "declared_model", "submitter",
        "accepted_at", "acceptance_event_id", "recorded_at", "record_event_id",
        "benchmark_commit", "production_metadata", "replay", "release", "public_solution",
        "model_id", "resolved_model_id"
      ],
      "properties": {
        "result_id": { "$ref": "public-state-projection-v3.schema.json#/$defs/result/properties/result_id" },
        "problem_id": { "$ref": "public-state-projection-v3.schema.json#/$defs/result/properties/problem_id" },
        "statement_revision": { "$ref": "public-state-projection-v3.schema.json#/$defs/result/properties/statement_revision" },
        "declared_model": { "$ref": "public-state-projection-v3.schema.json#/$defs/result/properties/declared_model" },
        "submitter": { "$ref": "public-state-projection-v3.schema.json#/$defs/result/properties/submitter" },
        "accepted_at": { "$ref": "public-state-projection-v3.schema.json#/$defs/result/properties/accepted_at" },
        "acceptance_event_id": { "$ref": "public-state-projection-v3.schema.json#/$defs/result/properties/acceptance_event_id" },
        "recorded_at": { "$ref": "public-state-projection-v3.schema.json#/$defs/result/properties/recorded_at" },
        "record_event_id": { "$ref": "public-state-projection-v3.schema.json#/$defs/result/properties/record_event_id" },
        "benchmark_commit": { "$ref": "public-state-projection-v3.schema.json#/$defs/result/properties/benchmark_commit" },
        "production_metadata": { "$ref": "public-state-projection-v3.schema.json#/$defs/result/properties/production_metadata" },
        "replay": { "$ref": "public-state-projection-v3.schema.json#/$defs/result/properties/replay" },
        "release": { "$ref": "public-state-projection-v3.schema.json#/$defs/result/properties/release" },
        "public_solution": { "$ref": "public-state-projection-v3.schema.json#/$defs/result/properties/public_solution" },
        "model_id": { "$ref": "#/$defs/nullableModelId" },
        "resolved_model_id": { "$ref": "#/$defs/nullableModelId" }
      }
    },
    "overlay": {
      "type": "object", "additionalProperties": false,
      "required": [
        "result_id", "owner_login", "declared_model", "problem_id",
        "statement_revision", "claim_event_id", "mutation_event_id", "claimed_at",
        "metadata", "model_id", "resolved_model_id"
      ],
      "properties": {
        "result_id": { "$ref": "public-state-projection-v2.schema.json#/$defs/overlay/properties/result_id" },
        "owner_login": { "$ref": "public-state-projection-v2.schema.json#/$defs/overlay/properties/owner_login" },
        "declared_model": { "$ref": "public-state-projection-v2.schema.json#/$defs/overlay/properties/declared_model" },
        "problem_id": { "$ref": "public-state-projection-v2.schema.json#/$defs/overlay/properties/problem_id" },
        "statement_revision": { "$ref": "public-state-projection-v2.schema.json#/$defs/overlay/properties/statement_revision" },
        "claim_event_id": { "$ref": "public-state-projection-v2.schema.json#/$defs/overlay/properties/claim_event_id" },
        "mutation_event_id": { "$ref": "public-state-projection-v2.schema.json#/$defs/overlay/properties/mutation_event_id" },
        "claimed_at": { "$ref": "public-state-projection-v2.schema.json#/$defs/overlay/properties/claimed_at" },
        "metadata": { "$ref": "public-state-projection-v2.schema.json#/$defs/overlay/properties/metadata" },
        "model_id": { "$ref": "#/$defs/nullableModelId" },
        "resolved_model_id": { "$ref": "#/$defs/nullableModelId" }
      }
    },
    "identity": {
      "type": "object", "additionalProperties": false,
      "required": [
        "model_id", "owner_login", "requested_name", "display_name", "status",
        "request_event_id", "requested_at", "decision_event_id", "decided_at",
        "reviewer_login", "rejection_reason", "mutation_event_id",
        "consolidated_into", "resolved_model_id"
      ],
      "properties": {
        "model_id": { "$ref": "#/$defs/modelId" },
        "owner_login": { "$ref": "#/$defs/login" },
        "requested_name": { "$ref": "#/$defs/label" },
        "display_name": { "$ref": "#/$defs/label" },
        "status": { "enum": ["pending", "approved", "rejected", "consolidated"] },
        "request_event_id": { "$ref": "public-state-projection-v1.schema.json#/$defs/eventId" },
        "requested_at": { "$ref": "#/$defs/timestamp" },
        "decision_event_id": { "$ref": "#/$defs/nullableEventId" },
        "decided_at": { "$ref": "#/$defs/nullableTimestamp" },
        "reviewer_login": { "oneOf": [{ "$ref": "#/$defs/login" }, { "type": "null" }] },
        "rejection_reason": { "$ref": "#/$defs/nullableReason" },
        "mutation_event_id": { "$ref": "public-state-projection-v1.schema.json#/$defs/eventId" },
        "consolidated_into": { "$ref": "#/$defs/nullableModelId" },
        "resolved_model_id": { "$ref": "#/$defs/nullableModelId" }
      }
    },
    "alias": {
      "type": "object", "additionalProperties": false,
      "required": [
        "alias_key", "owner_login", "alias", "model_id", "resolved_model_id",
        "assignment_event_id", "assigned_at"
      ],
      "properties": {
        "alias_key": { "$ref": "#/$defs/aliasKey" },
        "owner_login": { "$ref": "#/$defs/login" },
        "alias": { "$ref": "#/$defs/label" },
        "model_id": { "$ref": "#/$defs/modelId" },
        "resolved_model_id": { "$ref": "#/$defs/modelId" },
        "assignment_event_id": { "$ref": "public-state-projection-v1.schema.json#/$defs/eventId" },
        "assigned_at": { "$ref": "#/$defs/timestamp" }
      }
    },
    "history": {
      "type": "object", "additionalProperties": false,
      "required": [
        "event_id", "event_type", "model_id", "occurred_at", "causation_event_id",
        "actor_login", "display_name", "alias", "target_model_id", "reviewer_login",
        "reason_code"
      ],
      "properties": {
        "event_id": { "$ref": "public-state-projection-v1.schema.json#/$defs/eventId" },
        "event_type": {
          "enum": [
            "model_identity.requested", "model_identity.approved",
            "model_identity.rejected", "model_identity.alias_assigned",
            "model_identity.renamed", "model_identity.consolidated"
          ]
        },
        "model_id": { "$ref": "#/$defs/modelId" },
        "occurred_at": { "$ref": "#/$defs/timestamp" },
        "causation_event_id": { "$ref": "#/$defs/nullableEventId" },
        "actor_login": { "oneOf": [{ "$ref": "#/$defs/login" }, { "type": "null" }] },
        "display_name": { "$ref": "#/$defs/nullableLabel" },
        "alias": { "$ref": "#/$defs/nullableLabel" },
        "target_model_id": { "$ref": "#/$defs/nullableModelId" },
        "reviewer_login": { "oneOf": [{ "$ref": "#/$defs/login" }, { "type": "null" }] },
        "reason_code": { "$ref": "#/$defs/nullableReason" }
      }
    }
  }
}
